[
  {
    "id": "embolt",
    "name": "Embolt",
    "types": ["Fire"],
    "baseStats": {"hp": 39, "attack": 52, "defense": 43, "spAtk": 60, "spDef": 50, "speed": 65},
    "moves": ["scratch", "ember"],
    "evolvesInto": "boltiger",
    "evolutionLevel": 36,
    "pokedexEntry": "An energetic fire-type with a sparky personality.",
    "height": 0.3,
    "weight": 2.3,
    "catchRate": 45
  },
  {
    "id": "boltiger",
    "name": "Boltiger",
    "types": ["Fire"],
    "baseStats": {"hp": 58, "attack": 76, "defense": 58, "spAtk": 88, "spDef": 72, "speed": 93},
    "moves": ["scratch", "ember", "flame-burst", "thunderbolt"],
    "evolvesFrom": "embolt",
    "pokedexEntry": "The evolved form of Embolt, crackling with energy.",
    "height": 1.1,
    "weight": 40.5,
    "catchRate": 45
  },
  {
    "id": "aqualis",
    "name": "Aqualis",
    "types": ["Water"],
    "baseStats": {"hp": 44, "attack": 48, "defense": 65, "spAtk": 50, "spDef": 64, "speed": 43},
    "moves": ["water-gun", "bubblebeam"],
    "evolvesInto": "tidecrown",
    "evolutionLevel": 36,
    "pokedexEntry": "A calm water-type known for its defensive shell.",
    "height": 0.5,
    "weight": 7.9,
    "catchRate": 45
  },
  {
    "id": "tidecrown",
    "name": "Tidecrown",
    "types": ["Water"],
    "baseStats": {"hp": 65, "attack": 65, "defense": 100, "spAtk": 85, "spDef": 105, "speed": 60},
    "moves": ["water-gun", "bubblebeam", "aqua-ring"],
    "evolvesFrom": "aqualis",
    "pokedexEntry": "An elegant water-type with aquatic grace.",
    "height": 1.6,
    "weight": 39.2,
    "catchRate": 45
  },
  {
    "id": "thornwick",
    "name": "Thornwick",
    "types": ["Grass"],
    "baseStats": {"hp": 45, "attack": 49, "defense": 49, "spAtk": 65, "spDef": 49, "speed": 45},
    "moves": ["vine-whip", "growth"],
    "evolvesInto": "verdaxe",
    "evolutionLevel": 36,
    "pokedexEntry": "A nurturing grass-type with healing properties.",
    "height": 0.4,
    "weight": 2.6,
    "catchRate": 45
  },
  {
    "id": "verdaxe",
    "name": "Verdaxe",
    "types": ["Grass"],
    "baseStats": {"hp": 65, "attack": 75, "defense": 68, "spAtk": 90, "spDef": 72, "speed": 60},
    "moves": ["vine-whip", "growth", "flame-burst"],
    "evolvesFrom": "thornwick",
    "pokedexEntry": "A mighty grass-type warrior.",
    "height": 1.3,
    "weight": 16.8,
    "catchRate": 45
  },
  {
    "id": "sparkit",
    "name": "Sparkit",
    "types": ["Electric"],
    "baseStats": {"hp": 35, "attack": 42, "defense": 37, "spAtk": 47, "spDef": 40, "speed": 52},
    "moves": ["spark", "scratch"],
    "evolvesInto": "voltrix",
    "evolutionLevel": 20,
    "pokedexEntry": "A yellow mouse-like electric type, quick and sparky.",
    "height": 0.4,
    "weight": 6.0,
    "catchRate": 190
  },
  {
    "id": "voltrix",
    "name": "Voltrix",
    "types": ["Electric"],
    "baseStats": {"hp": 55, "attack": 65, "defense": 55, "spAtk": 72, "spDef": 60, "speed": 80},
    "moves": ["spark", "thunderbolt", "scratch"],
    "evolvesFrom": "sparkit",
    "pokedexEntry": "The evolved electric rodent, crackling with power.",
    "height": 0.8,
    "weight": 13.2,
    "catchRate": 190
  },
  {
    "id": "rockpile",
    "name": "Rockpile",
    "types": ["Fire"],
    "baseStats": {"hp": 35, "attack": 45, "defense": 52, "spAtk": 35, "spDef": 40, "speed": 35},
    "moves": ["tackle", "scratch"],
    "evolvesInto": "boulderan",
    "evolutionLevel": 25,
    "pokedexEntry": "A stubborn rock-type, slowly but surely advancing.",
    "height": 0.4,
    "weight": 18.0,
    "catchRate": 120
  },
  {
    "id": "boulderan",
    "name": "Boulderan",
    "types": ["Fire"],
    "baseStats": {"hp": 55, "attack": 70, "defense": 90, "spAtk": 50, "spDef": 60, "speed": 40},
    "moves": ["tackle", "earthquake", "scratch"],
    "evolvesFrom": "rockpile",
    "pokedexEntry": "A massive rock-type guardian.",
    "height": 1.3,
    "weight": 60.0,
    "catchRate": 120
  },
  {
    "id": "pupskin",
    "name": "Pupskin",
    "types": ["Fire"],
    "baseStats": {"hp": 37, "attack": 46, "defense": 36, "spAtk": 46, "spDef": 36, "speed": 35},
    "moves": ["tackle", "bite", "scratch"],
    "evolvesInto": "houndrake",
    "evolutionLevel": 22,
    "pokedexEntry": "A loyal dog-like critter with a fiery spirit.",
    "height": 0.5,
    "weight": 6.2,
    "catchRate": 180
  },
  {
    "id": "houndrake",
    "name": "Houndrake",
    "types": ["Fire"],
    "baseStats": {"hp": 65, "attack": 80, "defense": 50, "spAtk": 70, "spDef": 60, "speed": 65},
    "moves": ["tackle", "bite", "flame-burst", "scratch"],
    "evolvesFrom": "pupskin",
    "pokedexEntry": "An imposing fire beast with a fierce personality.",
    "height": 1.5,
    "weight": 24.0,
    "catchRate": 180
  },
  {
    "id": "frostwhip",
    "name": "Frostwhip",
    "types": ["Fire"],
    "baseStats": {"hp": 50, "attack": 50, "defense": 50, "spAtk": 65, "spDef": 60, "speed": 65},
    "moves": ["scratch", "bite"],
    "evolvesInto": "glaciarch",
    "evolutionLevel": 30,
    "pokedexEntry": "A mischievous snow creature that defies nature.",
    "height": 0.7,
    "weight": 12.5,
    "catchRate": 120
  },
  {
    "id": "glaciarch",
    "name": "Glaciarch",
    "types": ["Fire"],
    "baseStats": {"hp": 70, "attack": 65, "defense": 65, "spAtk": 95, "spDef": 85, "speed": 80},
    "moves": ["scratch", "thunderbolt", "bite"],
    "evolvesFrom": "frostwhip",
    "pokedexEntry": "A powerful snow sage with mystical powers.",
    "height": 1.4,
    "weight": 22.8,
    "catchRate": 120
  },
  {
    "id": "psychink",
    "name": "Psychink",
    "types": ["Psychic"],
    "baseStats": {"hp": 30, "attack": 25, "defense": 35, "spAtk": 70, "spDef": 60, "speed": 45},
    "moves": ["psychic", "scratch"],
    "evolvesInto": "mindseer",
    "evolutionLevel": 32,
    "pokedexEntry": "An alien-like telepath with strange abilities.",
    "height": 0.6,
    "weight": 4.2,
    "catchRate": 120
  },
  {
    "id": "mindseer",
    "name": "Mindseer",
    "types": ["Psychic"],
    "baseStats": {"hp": 55, "attack": 48, "defense": 60, "spAtk": 103, "spDef": 95, "speed": 77},
    "moves": ["psychic", "growth", "scratch"],
    "evolvesFrom": "psychink",
    "pokedexEntry": "A master of the psychic realm.",
    "height": 1.6,
    "weight": 48.0,
    "catchRate": 120
  },
  {
    "id": "venomling",
    "name": "Venomling",
    "types": ["Fire"],
    "baseStats": {"hp": 35, "attack": 42, "defense": 37, "spAtk": 50, "spDef": 35, "speed": 42},
    "moves": ["bite", "scratch"],
    "evolvesInto": "toxiclaw",
    "evolutionLevel": 29,
    "pokedexEntry": "A tiny toxic reptile with a venomous bite.",
    "height": 0.3,
    "weight": 5.5,
    "catchRate": 140
  },
  {
    "id": "toxiclaw",
    "name": "Toxiclaw",
    "types": ["Fire"],
    "baseStats": {"hp": 60, "attack": 75, "defense": 60, "spAtk": 75, "spDef": 65, "speed": 70},
    "moves": ["bite", "flame-burst", "scratch"],
    "evolvesFrom": "venomling",
    "pokedexEntry": "A dangerous poison dealer.",
    "height": 1.1,
    "weight": 25.0,
    "catchRate": 140
  },
  {
    "id": "stoneguard",
    "name": "Stoneguard",
    "types": ["Ground"],
    "baseStats": {"hp": 65, "attack": 75, "defense": 100, "spAtk": 35, "spDef": 40, "speed": 25},
    "moves": ["earthquake", "tackle"],
    "evolvesInto": "terrasmith",
    "evolutionLevel": 34,
    "pokedexEntry": "A slow but solid earth guardian.",
    "height": 1.0,
    "weight": 88.5,
    "catchRate": 120
  },
  {
    "id": "terrasmith",
    "name": "Terrasmith",
    "types": ["Ground"],
    "baseStats": {"hp": 85, "attack": 100, "defense": 125, "spAtk": 55, "spDef": 60, "speed": 30},
    "moves": ["earthquake", "tackle", "psychic"],
    "evolvesFrom": "stoneguard",
    "pokedexEntry": "An unstoppable force of nature.",
    "height": 1.6,
    "weight": 128.0,
    "catchRate": 120
  },
  {
    "id": "lightbringer",
    "name": "Lightbringer",
    "types": ["Fairy"],
    "baseStats": {"hp": 45, "attack": 48, "defense": 48, "spAtk": 62, "spDef": 66, "speed": 42},
    "moves": ["fairy-wind", "scratch"],
    "evolvesInto": "radianceking",
    "evolutionLevel": 39,
    "pokedexEntry": "A magical sparkly fairy-type.",
    "height": 0.6,
    "weight": 1.5,
    "catchRate": 150
  },
  {
    "id": "radianceking",
    "name": "Radianceking",
    "types": ["Fairy"],
    "baseStats": {"hp": 68, "attack": 65, "defense": 68, "spAtk": 85, "spDef": 88, "speed": 72},
    "moves": ["fairy-wind", "psychic", "scratch"],
    "evolvesFrom": "lightbringer",
    "pokedexEntry": "A radiant celestial being.",
    "height": 1.3,
    "weight": 4.2,
    "catchRate": 150
  },
  {
    "id": "infernus",
    "name": "Infernus",
    "types": ["Fire", "Dark"],
    "baseStats": {"hp": 75, "attack": 131, "defense": 95, "spAtk": 106, "spDef": 95, "speed": 77},
    "moves": ["flame-burst", "bite", "earthquake"],
    "pokedexEntry": "A legendary fire-dark hybrid of immense power.",
    "height": 2.0,
    "weight": 150.0,
    "catchRate": 3
  },
  {
    "id": "tidal",
    "name": "Tidal",
    "types": ["Water", "Electric"],
    "baseStats": {"hp": 75, "attack": 88, "defense": 111, "spAtk": 112, "spDef": 97, "speed": 72},
    "moves": ["water-gun", "thunderbolt", "aqua-ring"],
    "pokedexEntry": "A legendary water-electric deity.",
    "height": 1.8,
    "weight": 145.0,
    "catchRate": 3
  },
  {
    "id": "natureveil",
    "name": "Natureveil",
    "types": ["Grass", "Fairy"],
    "baseStats": {"hp": 80, "attack": 65, "defense": 100, "spAtk": 120, "spDef": 120, "speed": 65},
    "moves": ["vine-whip", "fairy-wind", "growth"],
    "pokedexEntry": "A legendary guardian of nature.",
    "height": 2.5,
    "weight": 88.8,
    "catchRate": 3
  },
  {
    "id": "voltcharge",
    "name": "Voltcharge",
    "types": ["Electric"],
    "baseStats": {"hp": 40, "attack": 50, "defense": 40, "spAtk": 60, "spDef": 40, "speed": 70},
    "moves": ["spark", "tackle"],
    "pokedexEntry": "A small but energetic electric critter.",
    "height": 0.3,
    "weight": 3.5,